{"profile_digest":"dac9bbac1cfba25f0ae899d631e867e31056764ed884b7a1dca79ba0e7f72a78","profile_id":"proof.integration.prefix-safety","profile_version":"1.0.0","relations":[{"operator":"deterministic_projection","relation_id":"derive-prefix-census","result_requirement_id":"prefix-census","source_requirement_ids":["dag-source","integration-units","execution-paths"],"transformer_id":"integration-prefix-census.v1"}],"requirements":[{"binding_kind":"artifact_bytes","requirement_id":"dag-source","role_coverage":[{"coverage":"exact","projection":"artifact_subject","role":"integration_dag"}]},{"binding_kind":"artifact_bytes","requirement_id":"execution-paths","role_coverage":[{"coverage":"exact","projection":"artifact_subject","role":"execution_paths"}]},{"binding_kind":"artifact_bytes","requirement_id":"integration-units","role_coverage":[{"coverage":"exact","projection":"artifact_subject","role":"integration_units"}]},{"binding_kind":"artifact_bytes","requirement_id":"prefix-census","role_coverage":[{"coverage":"exact","population_id":"cases","projection":"projection_result_population","role":"prefix_cases"},{"coverage":"exact","projection":"artifact_subject","role":"prefix_census"}]}],"schema_version":"controlled-contract-exact-binding-declaration.v1"}
