{"profile_digest":"26de4857cff1acf69084e4e89d5785771e97df5b98c50daa2163cb1a3218059c","profile_id":"proof.ordering.lexicographic-conformance","profile_version":"1.0.0","relations":[{"operator":"deterministic_projection","relation_id":"derive-lexicographic-conformance","result_requirement_id":"conformance-report","source_requirement_ids":["comparator-evidence","input-snapshot","ordering-policy","result-snapshot"],"transformer_id":"deterministic-lexicographic-conformance.v1"},{"operator":"distinct_source_descriptor","relation_id":"independent-exact-sources","requirement_ids":["comparator-evidence","input-snapshot","ordering-policy","result-snapshot"]}],"requirements":[{"binding_kind":"artifact_bytes","requirement_id":"comparator-evidence","role_coverage":[{"coverage":"exact","projection":"artifact_subject","role":"item_key_evidence"}]},{"binding_kind":"artifact_bytes","requirement_id":"conformance-report","role_coverage":[{"coverage":"exact","projection":"artifact_subject","role":"conformance_report"},{"coverage":"exact","population_id":"declared-items","projection":"projection_result_population","role":"declared_items"},{"coverage":"exact","population_id":"policy-keys","projection":"projection_result_population","role":"policy_keys"},{"coverage":"exact","projection":"artifact_subject","role":"result_count_signal"},{"coverage":"exact","population_id":"result-items","projection":"projection_result_population","role":"result_items"}]},{"binding_kind":"artifact_bytes","requirement_id":"input-snapshot","role_coverage":[{"coverage":"exact","projection":"artifact_subject","role":"input_snapshot"}]},{"binding_kind":"artifact_bytes","requirement_id":"ordering-policy","role_coverage":[{"coverage":"exact","projection":"artifact_subject","role":"ordering_policy"}]},{"binding_kind":"artifact_bytes","requirement_id":"result-snapshot","role_coverage":[{"coverage":"exact","projection":"artifact_subject","role":"result_snapshot"}]}],"schema_version":"controlled-contract-exact-binding-declaration.v1"}
