{"profile_digest":"fedc131cdb3739d10ca9143708a3419f6ac4f7eb004a6d1d5ce0e13b43493761","profile_id":"proof.compatibility.behavioral-preservation","profile_version":"1.0.0","relations":[{"operator":"distinct_source_descriptor","relation_id":"baseline-and-candidate-have-distinct-source-descriptors","requirement_ids":["baseline-behavior-report","candidate-behavior-report"]},{"operator":"same_content_sha256","relation_id":"baseline-and-candidate-have-identical-complete-bytes","requirement_ids":["baseline-behavior-report","candidate-behavior-report"]}],"requirements":[{"binding_kind":"artifact_bytes","requirement_id":"baseline-behavior-report","role_coverage":[{"coverage":"exact","projection":"artifact_subject","role":"left_result"}]},{"binding_kind":"artifact_bytes","requirement_id":"candidate-behavior-report","role_coverage":[{"coverage":"exact","projection":"artifact_subject","role":"right_result"}]}],"schema_version":"controlled-contract-exact-binding-declaration.v1"}
