{"profile_digest":"34fe6942fc06d74abb0faef0f4488c81b56d2f165f83ceb7ca9595aef79ff69c","profile_id":"proof.dormancy.nonactivation","profile_version":"1.0.0","relations":[{"operator":"distinct_source_descriptor","relation_id":"independent-captured-inputs","requirement_ids":["activation-observation-artifact","default-configuration-artifact","production-reachability-snapshot"]}],"requirements":[{"binding_kind":"artifact_bytes","requirement_id":"activation-observation-artifact","role_coverage":[{"coverage":"exact","projection":"artifact_subject","role":"activation_trace"}]},{"binding_kind":"artifact_bytes","requirement_id":"default-configuration-artifact","role_coverage":[{"coverage":"exact","projection":"artifact_subject","role":"default_configuration_artifact"}]},{"binding_kind":"complete_reachability_snapshot","requirement_id":"production-reachability-snapshot","role_coverage":[{"coverage":"exact","projection":"snapshot_population","role":"graph_nodes"},{"coverage":"exact","projection":"snapshot_subject","role":"production_graph"}]}],"schema_version":"controlled-contract-exact-binding-declaration.v1"}
